{
	"product":
	{
		"name": "Avril",
		"owner": "Belwest",
		"brand": "Belwest",
		"collection": "Visual Quality Control PoC",
		"last_modified": "27-03-20",
		"version": 1.0,
		"main_material": "suede",
		"main_color": "purple",
		"target_category": "women",
		"season": "",
		"tip": "round",
		"closed": true,
		"closing": "strap",
		"heel_height": 9.0,
		"shoe_height": 15.9,
		"angles":
		[
			"inner"
		],
		"zones":
		[
			"buckle",
			"heel",
			"heel_cap",
			"heelcap",
			"heelcap_stitches",
			"insole",
			"lining",
			"lining_stitches",
			"lining_heelcap",
			"lining_heelcap_stitches",
			"outsole",
			"sole",
			"toecap",
			"toecap_stitches",
			"upper",
			"upper_stitches"
		],
		"process":
		{
			"assets":
			{
				"Avril CAD Model 1": { "type": "sho", "file": "belwest_avril_1937781_upgrade by dxf drawings.sho" },
				"Avril Model 1": { "type": "blend", "file": "female.blend" },
				"Avril Model 2": { "type": "blend", "file": "female_inner.blend" },
				"Avril Materials": { "type": "blend", "file": "female_materials.blend" }
			},
			"cad": "ShoeMaster v. 18",
			"rendering": "Blender scripting by ICOL R&D",
			"datasets":
			[
				{
					"name": "inner_data",
					"version": 1.0,
					"size": 300
				}
			]
		}
	},
	"angles":
	[
		{
			"name": "inner",
			"value": 0.0,
			"offset": 12.5
		}
	],
	"components":
	[
		{
			"name": "toecap",
			"variants":
			[
				{
					"name": "toecap",
					"file": "female_inner.blend",
					"materials":
					[
						{
							"name": "mat_suede",
							"file": "female_materials.blend",
							"colors":
							[
								{ "name": "FF9DA2", "code": "FF9DA2" },
								{ "name": "F5CABF", "code": "F5CABF" },
								{ "name": "CF578A", "code": "CF578A" },
								{ "name": "DB8A06", "code": "DB8A06" },
								{ "name": "FDAA63", "code": "FDAA63" },
								{ "name": "B6ADA5", "code": "B6ADA5" },
								{ "name": "B8CCEA", "code": "B8CCEA" },
								{ "name": "8E9FBC", "code": "8E9FBC" },
								{ "name": "AD7C59", "code": "AD7C59" },
								{ "name": "8B5B29", "code": "8B5B29" }
							]
						},
						{
							"name": "mat_volpiana",
							"file": "female_materials.blend",
							"colors":
							[
								{ "name": "FF9DA2", "code": "FF9DA2" },
								{ "name": "F5CABF", "code": "F5CABF" },
								{ "name": "CF578A", "code": "CF578A" },
								{ "name": "DB8A06", "code": "DB8A06" },
								{ "name": "FDAA63", "code": "FDAA63" },
								{ "name": "B6ADA5", "code": "B6ADA5" },
								{ "name": "B8CCEA", "code": "B8CCEA" },
								{ "name": "8E9FBC", "code": "8E9FBC" },
								{ "name": "AD7C59", "code": "AD7C59" },
								{ "name": "8B5B29", "code": "8B5B29" }
							]
						},
						{
							"name": "mat_nubuk",
							"file": "female_materials.blend",
							"colors":
							[
								{ "name": "FF9DA2", "code": "FF9DA2" },
								{ "name": "F5CABF", "code": "F5CABF" },
								{ "name": "CF578A", "code": "CF578A" },
								{ "name": "DB8A06", "code": "DB8A06" },
								{ "name": "FDAA63", "code": "FDAA63" },
								{ "name": "B6ADA5", "code": "B6ADA5" },
								{ "name": "B8CCEA", "code": "B8CCEA" },
								{ "name": "8E9FBC", "code": "8E9FBC" },
								{ "name": "AD7C59", "code": "AD7C59" },
								{ "name": "8B5B29", "code": "8B5B29" }
							]
						},
						{
							"name": "mat_denim",
							"file": "female_materials.blend",
							"colors":
							[
								{ "name": "FF9DA2", "code": "FF9DA2" },
								{ "name": "F5CABF", "code": "F5CABF" },
								{ "name": "CF578A", "code": "CF578A" },
								{ "name": "DB8A06", "code": "DB8A06" },
								{ "name": "FDAA63", "code": "FDAA63" },
								{ "name": "B6ADA5", "code": "B6ADA5" },
								{ "name": "B8CCEA", "code": "B8CCEA" },
								{ "name": "8E9FBC", "code": "8E9FBC" },
								{ "name": "AD7C59", "code": "AD7C59" },
								{ "name": "8B5B29", "code": "8B5B29" }
							]
						},
						{
							"name": "mat_knitted",
							"file": "female_materials.blend",
							"colors":
							[
								{ "name": "FF9DA2", "code": "FF9DA2" },
								{ "name": "F5CABF", "code": "F5CABF" },
								{ "name": "CF578A", "code": "CF578A" },
								{ "name": "DB8A06", "code": "DB8A06" },
								{ "name": "FDAA63", "code": "FDAA63" },
								{ "name": "B6ADA5", "code": "B6ADA5" },
								{ "name": "B8CCEA", "code": "B8CCEA" },
								{ "name": "8E9FBC", "code": "8E9FBC" },
								{ "name": "AD7C59", "code": "AD7C59" },
								{ "name": "8B5B29", "code": "8B5B29" }
							]
						},
						{
							"name": "mat_sm_pearlsnake",
							"file": "female_materials.blend",
							"colors":
							[
								{ "name": "FF9DA2", "code": "FF9DA2" },
								{ "name": "F5CABF", "code": "F5CABF" },
								{ "name": "CF578A", "code": "CF578A" },
								{ "name": "DB8A06", "code": "DB8A06" },
								{ "name": "FDAA63", "code": "FDAA63" },
								{ "name": "B6ADA5", "code": "B6ADA5" },
								{ "name": "B8CCEA", "code": "B8CCEA" },
								{ "name": "8E9FBC", "code": "8E9FBC" },
								{ "name": "AD7C59", "code": "AD7C59" },
								{ "name": "8B5B29", "code": "8B5B29" }
							]
						}
					]
				}
			],
			"mask_material":
			{
				"name": "mat_flat_color",
				"file": "female_materials.blend",
				"colors":
				[
					{ "name": "FF0000", "code": "FF0000" }
				]
			},
			"landmark_material":
			{
				"name": "mat_flat_color",
				"file": "female_materials.blend",
				"colors":
				[
					{ "name": "Flat Black", "code": "000000" }
				]
			}
 		},
		{
			"name": "toecap_stitches",
			"variants":
			[
				{
					"name": "toecap_stitches",
					"file": "female_inner.blend",
					"materials":
					[
						{
							"name": "mat_cotton",
							"file": "female_materials.blend",
							"colors":
							[
								{ "name": "FF9DA2", "code": "FF9DA2" },
								{ "name": "F5CABF", "code": "F5CABF" },
								{ "name": "CF578A", "code": "CF578A" },
								{ "name": "DB8A06", "code": "DB8A06" },
								{ "name": "FDAA63", "code": "FDAA63" },
								{ "name": "B6ADA5", "code": "B6ADA5" },
								{ "name": "B8CCEA", "code": "B8CCEA" },
								{ "name": "8E9FBC", "code": "8E9FBC" },
								{ "name": "AD7C59", "code": "AD7C59" },
								{ "name": "8B5B29", "code": "8B5B29" }
							]
						}
					]
				}
			],
			"mask_material":
			{
				"name": "mat_flat_color",
				"file": "female_materials.blend",
				"colors":
				[
					{ "name": "00FFFF", "code": "00FFFF" }
				]
			},
			"landmark_material":
			{
				"name": "mat_flat_color",
				"file": "female_materials.blend",
				"colors":
				[
					{ "name": "Flat Black", "code": "000000" }
				]
			}
 		},
		{
			"name": "upper",
			"variants":
			[
				{
					"name": "upper",
					"file": "female_inner.blend",
					"materials":
					[
						{
							"name": "mat_shiny_leather",
							"file": "female_materials.blend",
							"colors":
							[
								{ "name": "B66C6D", "code": "B66C6D" },
								{ "name": "E1A6AD", "code": "E1A6AD" },
								{ "name": "A64570", "code": "A64570" },
								{ "name": "C16C18", "code": "C16C18" },
								{ "name": "DE9353", "code": "DE9353" },
								{ "name": "83786F", "code": "83786F" },
								{ "name": "8FACD8", "code": "8FACD8" },
								{ "name": "6E7CA0", "code": "6E7CA0" },
								{ "name": "946037", "code": "946037" },
								{ "name": "744F28", "code": "744F28" }
							]
						},
						{
							"name": "mat_calf_leather",
							"file": "female_materials.blend",
							"colors":
							[
								{ "name": "B66C6D", "code": "B66C6D" },
								{ "name": "E1A6AD", "code": "E1A6AD" },
								{ "name": "A64570", "code": "A64570" },
								{ "name": "C16C18", "code": "C16C18" },
								{ "name": "DE9353", "code": "DE9353" },
								{ "name": "83786F", "code": "83786F" },
								{ "name": "8FACD8", "code": "8FACD8" },
								{ "name": "6E7CA0", "code": "6E7CA0" },
								{ "name": "946037", "code": "946037" },
								{ "name": "744F28", "code": "744F28" }
							]
						},
						{
							"name": "mat_leather",
							"file": "female_materials.blend",
							"colors":
							[
								{ "name": "B66C6D", "code": "B66C6D" },
								{ "name": "E1A6AD", "code": "E1A6AD" },
								{ "name": "A64570", "code": "A64570" },
								{ "name": "C16C18", "code": "C16C18" },
								{ "name": "DE9353", "code": "DE9353" },
								{ "name": "83786F", "code": "83786F" },
								{ "name": "8FACD8", "code": "8FACD8" },
								{ "name": "6E7CA0", "code": "6E7CA0" },
								{ "name": "946037", "code": "946037" },
								{ "name": "744F28", "code": "744F28" }
							]
						},
						{
							"name": "mat_textile",
							"file": "female_materials.blend",
							"colors":
							[
								{ "name": "B66C6D", "code": "B66C6D" },
								{ "name": "E1A6AD", "code": "E1A6AD" },
								{ "name": "A64570", "code": "A64570" },
								{ "name": "C16C18", "code": "C16C18" },
								{ "name": "DE9353", "code": "DE9353" },
								{ "name": "83786F", "code": "83786F" },
								{ "name": "8FACD8", "code": "8FACD8" },
								{ "name": "6E7CA0", "code": "6E7CA0" },
								{ "name": "946037", "code": "946037" },
								{ "name": "744F28", "code": "744F28" }
							]
						},
						{
							"name": "mat_fabric",
							"file": "female_materials.blend",
							"colors":
							[
								{ "name": "B66C6D", "code": "B66C6D" },
								{ "name": "E1A6AD", "code": "E1A6AD" },
								{ "name": "A64570", "code": "A64570" },
								{ "name": "C16C18", "code": "C16C18" },
								{ "name": "DE9353", "code": "DE9353" },
								{ "name": "83786F", "code": "83786F" },
								{ "name": "8FACD8", "code": "8FACD8" },
								{ "name": "6E7CA0", "code": "6E7CA0" },